{
	"id": "release",
	"label": "Changesets release workflow",
	"description": "Changesets release workflow, publish preflight, and release documentation.",
	"files": [
		".changeset",
		".github/workflows/release.yml",
		"scripts/release-preflight.mjs",
		"scripts/publish-packages.mjs"
	],
	"scripts": [
		"release:preflight",
		"publish:packages",
		"changeset"
	],
	"devDependencies": [
		"@changesets/changelog-github",
		"@changesets/cli"
	]
}
